{
  "$schema": "../../schema/platform-config.schema.json",
  "platform": "opencode",
  "binary": "opencode",
  "schemas": {
    "generated_config": "opencode_config"
  },
  "managed_keys": [
    "agent",
    "command",
    "default_agent",
    "disabled_providers",
    "enabled_providers",
    "instructions",
    "mcp",
    "model",
    "permission",
    "plugin",
    "provider",
    "skills",
    "small_model",
    "tool_output",
    "tools",
    "watcher"
  ],
  "required_config": {
    "default_agent": "athena",
    "small_model": "opencode/ling-2.6-flash-free"
  },
  "route_defaults": {
    "implement": [
      "opencode/big-pickle",
      "opencode/minimax-m2.5-free",
      "opencode/hy3-preview-free",
      "opencode/ling-2.6-flash-free",
      "opencode/nemotron-3-super-free"
    ],
    "debug": [
      "opencode/minimax-m2.5-free",
      "opencode/big-pickle",
      "opencode/hy3-preview-free",
      "opencode/nemotron-3-super-free",
      "opencode/ling-2.6-flash-free"
    ],
    "utility": [
      "opencode/ling-2.6-flash-free",
      "opencode/hy3-preview-free",
      "opencode/nemotron-3-super-free",
      "opencode/minimax-m2.5-free",
      "opencode/big-pickle"
    ],
    "review": [
      "opencode/minimax-m2.5-free",
      "opencode/big-pickle",
      "opencode/nemotron-3-super-free",
      "opencode/hy3-preview-free",
      "opencode/ling-2.6-flash-free"
    ]
  },
  "doctor": {
    "reject_when": [
      "schema validation fails",
      "default_agent not in Greek-gods agent set",
      "route model not in OpenCode free fallback set"
    ]
  }
}
